{
  "schema": "r8-v15-r1-guard-omission-source-evidence/v1",
  "status": "REVIEW_EVIDENCE_NON_AUTHORITATIVE",
  "authority_effect": "NONE",
  "semantic_candidate_commit": "c721b38cf8b00294797300b526596ce723a47ff8",
  "purpose": "Close independent-review H-1 by embedding the exact 11 canonical omitted guard-table source ranges and making the digest basis and set-reparse proof reproducible from the handoff itself.",
  "digest_contract": {
    "algorithm": "SHA-256",
    "text_encoding": "UTF-8",
    "line_separator": "LF",
    "trailing_line_separator_added": false,
    "digest_field": "raw_section_sha256",
    "verification_instruction": "Hash the exact JSON string value in `excerpt` after JSON decoding; do not trim, normalize whitespace, or add a newline."
  },
  "record_count": 11,
  "all_guard_sets_equal": true,
  "all_case_sets_equal": true,
  "records": [
    {
      "source_version": "v4",
      "source_path": "governance-r8/R8-META-GOVERNANCE-PREREGISTRATION-V4.md",
      "source_commit": "d779eb495b5830674e0258d4d27b768f77e10471",
      "source_blob": "8597233a08c77c0ab928868eaec4c13c425a2eac",
      "line_start": 596,
      "line_end": 622,
      "digest_basis": "SHA-256 over UTF-8 bytes of `excerpt` exactly as embedded; LF separators; no trailing LF added",
      "raw_section_sha256": "c7fb008c57b3ff002934f604f8ac294b2e536c4e557599e56bb763e525b3b6c9",
      "raw_section_bytes": 1897,
      "parsed_guard_ids": [
        "G001",
        "G002",
        "G003",
        "G004",
        "G005",
        "G006",
        "G007",
        "G008",
        "G009",
        "G010",
        "G011",
        "G012",
        "G013",
        "G014",
        "G015",
        "G016",
        "G017",
        "G018",
        "G019",
        "G020",
        "G021",
        "G022",
        "G023",
        "G024",
        "G025"
      ],
      "parsed_case_ids": [
        "V4-001",
        "V4-002",
        "V4-003",
        "V4-004",
        "V4-005",
        "V4-006",
        "V4-007",
        "V4-008",
        "V4-009",
        "V4-010",
        "V4-011",
        "V4-012",
        "V4-013",
        "V4-014",
        "V4-015",
        "V4-016",
        "V4-017",
        "V4-018",
        "V4-019",
        "V4-020",
        "V4-021",
        "V4-022",
        "V4-023",
        "V4-024",
        "V4-025",
        "V4-026",
        "V4-027",
        "V4-028",
        "V4-029",
        "V4-030",
        "V4-031",
        "V4-032",
        "V4-033",
        "V4-034",
        "V4-035",
        "V4-036",
        "V4-037",
        "V4-038",
        "V4-039",
        "V4-040",
        "V4-041",
        "V4-042",
        "V4-043",
        "V4-044",
        "V4-045",
        "V4-046",
        "V4-047",
        "V4-048",
        "V4-049",
        "V4-050",
        "V4-051",
        "V4-052",
        "V4-053",
        "V4-054",
        "V4-055",
        "V4-056",
        "V4-057",
        "V4-058",
        "V4-059",
        "V4-060",
        "V4-061",
        "V4-062",
        "V4-063",
        "V4-064",
        "V4-065",
        "V4-066",
        "V4-067",
        "V4-068",
        "V4-069",
        "V4-070",
        "V4-071",
        "V4-072",
        "V4-073",
        "V4-074",
        "V4-075",
        "V4-076",
        "V4-077",
        "V4-078",
        "V4-079",
        "V4-080",
        "V4-081",
        "V4-082",
        "V4-083",
        "V4-084"
      ],
      "manifest_guard_ids": [
        "G001",
        "G002",
        "G003",
        "G004",
        "G005",
        "G006",
        "G007",
        "G008",
        "G009",
        "G010",
        "G011",
        "G012",
        "G013",
        "G014",
        "G015",
        "G016",
        "G017",
        "G018",
        "G019",
        "G020",
        "G021",
        "G022",
        "G023",
        "G024",
        "G025"
      ],
      "manifest_case_ids": [
        "V4-001",
        "V4-002",
        "V4-003",
        "V4-004",
        "V4-005",
        "V4-006",
        "V4-007",
        "V4-008",
        "V4-009",
        "V4-010",
        "V4-011",
        "V4-012",
        "V4-013",
        "V4-014",
        "V4-015",
        "V4-016",
        "V4-017",
        "V4-018",
        "V4-019",
        "V4-020",
        "V4-021",
        "V4-022",
        "V4-023",
        "V4-024",
        "V4-025",
        "V4-026",
        "V4-027",
        "V4-028",
        "V4-029",
        "V4-030",
        "V4-031",
        "V4-032",
        "V4-033",
        "V4-034",
        "V4-035",
        "V4-036",
        "V4-037",
        "V4-038",
        "V4-039",
        "V4-040",
        "V4-041",
        "V4-042",
        "V4-043",
        "V4-044",
        "V4-045",
        "V4-046",
        "V4-047",
        "V4-048",
        "V4-049",
        "V4-050",
        "V4-051",
        "V4-052",
        "V4-053",
        "V4-054",
        "V4-055",
        "V4-056",
        "V4-057",
        "V4-058",
        "V4-059",
        "V4-060",
        "V4-061",
        "V4-062",
        "V4-063",
        "V4-064",
        "V4-065",
        "V4-066",
        "V4-067",
        "V4-068",
        "V4-069",
        "V4-070",
        "V4-071",
        "V4-072",
        "V4-073",
        "V4-074",
        "V4-075",
        "V4-076",
        "V4-077",
        "V4-078",
        "V4-079",
        "V4-080",
        "V4-081",
        "V4-082",
        "V4-083",
        "V4-084"
      ],
      "verification": {
        "guard_set_equal": true,
        "case_set_equal": true,
        "missing_guard_ids": [],
        "extra_guard_ids": [],
        "missing_case_ids": [],
        "extra_case_ids": []
      },
      "excerpt": "| Guard ID | Load-bearing mechanism | Positive control | Negative/adversarial cases |\n|---|---|---|---|\n| G001 | EBA ControllerAttestation verification | V4-001 | V4-002,V4-003 |\n| G002 | BootstrapAuthorization + singleton CAS | V4-004 | V4-005,V4-006 |\n| G003 | Root quorum independence | V4-007 | V4-008,V4-009 |\n| G004 | Recovery quorum + trigger proof | V4-010 | V4-011,V4-012 |\n| G005 | Anchor quorum + witness | V4-013 | V4-014,V4-015,V4-016 |\n| G006 | Atomic CAS_APPEND | V4-017 | V4-018,V4-019 |\n| G007 | Constitutional semantic digest gate | V4-020 | V4-021,V4-022 |\n| G008 | GCP-1 canonicalization/parser | V4-023 | V4-024..V4-030 |\n| G009 | SPR lifecycle/stable primitive IDs | V4-031 | V4-032,V4-033 |\n| G010 | Reviewer independence + two-channel constitutional review | V4-034 | V4-035,V4-036,V4-037 |\n| G011 | Issuer separation of duties | V4-038 | V4-039,V4-040 |\n| G012 | Revocation monotonic use-time validation | V4-041 | V4-042,V4-043 |\n| G013 | Context-bound time quorum | V4-044 | V4-045,V4-046,V4-047 |\n| G014 | Materiality field-mask classifier | V4-048 | V4-049,V4-050 |\n| G015 | QualifiedEvidenceProducer strong evidence | V4-051 | V4-052,V4-053,V4-054 |\n| G016 | Stable tenant/authority IDs only | V4-055 | V4-056,V4-057 |\n| G017 | Checkpoint producer + immediate anchor | V4-058 | V4-059,V4-060 |\n| G018 | State-root out-of-band mutation detection | V4-061 | V4-062,V4-063 |\n| G019 | Registry/head rollback-fork guard | V4-064 | V4-065,V4-066 |\n| G020 | Recovery blocked-state bypass guard | V4-067 | V4-068,V4-069 |\n| G021 | Repository/history migration anchor | V4-070 | V4-071,V4-072 |\n| G022 | Evidence transition closed table | V4-073 | V4-074,V4-075 |\n| G023 | PLATFORM_POLICY exact-condition issuer | V4-076 | V4-077,V4-078 |\n| G024 | Constitutional unrecoverable boundary | V4-079 | V4-080 |\n| G025 | Mechanism-proof adjudicator | V4-081 | V4-082,V4-083,V4-084 |"
    },
    {
      "source_version": "v5",
      "source_path": "governance-r8/R8-META-GOVERNANCE-PREREGISTRATION-V5.md",
      "source_commit": "53d695dff34d14365770d1dbdad8c6620e31a503",
      "source_blob": "bb3049b9dd4ba5c1691f518b9903900dea65711b",
      "line_start": 586,
      "line_end": 604,
      "digest_basis": "SHA-256 over UTF-8 bytes of `excerpt` exactly as embedded; LF separators; no trailing LF added",
      "raw_section_sha256": "0980a281f32aa3200b7e1378b9d6094a4e74761e1a839d372ca0aacc8bf8aa0f",
      "raw_section_bytes": 1328,
      "parsed_guard_ids": [
        "G026",
        "G027",
        "G028",
        "G029",
        "G030",
        "G031",
        "G032",
        "G033",
        "G034",
        "G035",
        "G036",
        "G037",
        "G038",
        "G039",
        "G040",
        "G041",
        "G042"
      ],
      "parsed_case_ids": [
        "V5-001",
        "V5-002",
        "V5-003",
        "V5-004",
        "V5-005",
        "V5-006",
        "V5-007",
        "V5-008",
        "V5-009",
        "V5-010",
        "V5-011",
        "V5-012",
        "V5-013",
        "V5-014",
        "V5-015",
        "V5-016",
        "V5-017",
        "V5-018",
        "V5-019",
        "V5-020",
        "V5-021",
        "V5-022",
        "V5-023",
        "V5-024",
        "V5-025",
        "V5-026",
        "V5-027",
        "V5-028",
        "V5-029",
        "V5-030",
        "V5-031",
        "V5-032",
        "V5-033",
        "V5-034",
        "V5-035",
        "V5-036",
        "V5-037",
        "V5-038",
        "V5-039",
        "V5-040",
        "V5-041",
        "V5-042",
        "V5-043",
        "V5-044",
        "V5-045",
        "V5-046",
        "V5-047",
        "V5-048",
        "V5-049",
        "V5-050",
        "V5-051",
        "V5-052",
        "V5-053",
        "V5-054"
      ],
      "manifest_guard_ids": [
        "G026",
        "G027",
        "G028",
        "G029",
        "G030",
        "G031",
        "G032",
        "G033",
        "G034",
        "G035",
        "G036",
        "G037",
        "G038",
        "G039",
        "G040",
        "G041",
        "G042"
      ],
      "manifest_case_ids": [
        "V5-001",
        "V5-002",
        "V5-003",
        "V5-004",
        "V5-005",
        "V5-006",
        "V5-007",
        "V5-008",
        "V5-009",
        "V5-010",
        "V5-011",
        "V5-012",
        "V5-013",